{
  "specversion": "1.0",
  "id": "01H8EXAMPLEASSEMB0000000001",
  "source": "phrase-assembler",
  "type": "rg.phrase-assembled.v1",
  "subject": "runs/102b7eee-131c-5179-9436-a7cd1e5bbf61",
  "time": "2026-08-04T10:45:42.000Z",
  "datacontenttype": "application/json",
  "traceparent": "00-0af7651916cd43dd8448eb211c804ad-b7ad6b7169203331-01",
  "correlationid": "102b7eee-131c-5179-9436-a7cd1e5bbf61",
  "data": {
    "runId": "102b7eee-131c-5179-9436-a7cd1e5bbf61",
    "stepId": "3259001d-3ba0-40ed-96e2-95ca67e6a43c",
    "attempt": 1,
    "inputMaturity": 80,
    "outputMaturity": 90,
    "inputArtifacts": [
      "96fac3e8-53bd-49d5-a65e-7882efe1c43f",
      "d84a4ad3-5165-4459-8dee-fc4835e59694"
    ],
    "outputArtifacts": [
      "342b8f7a-f5a0-4cdd-8e54-3bd68d2f504d"
    ],
    "transformation": {
      "name": "assemble-phrase",
      "version": "1.0"
    },
    "assembledText": "H1 W0r1d",
    "sha256": "d4e5f6a7b8c9"
  }
}