{
  "specversion": "1.0",
  "id": "01H8EXAMPLEGEOM00000000001",
  "source": "geometry-engine",
  "type": "rg.geometry-expanded.v1",
  "subject": "runs/102b7eee-131c-5179-9436-a7cd1e5bbf61/glyphs/c6075091-af49-4dfe-a2f6-865e76aadd16",
  "time": "2026-08-04T10:45:15.000Z",
  "datacontenttype": "application/json",
  "traceparent": "00-0af7651916cd43dd8448eb211c804ad-b7ad6b7169203331-01",
  "correlationid": "102b7eee-131c-5179-9436-a7cd1e5bbf61",
  "data": {
    "runId": "102b7eee-131c-5179-9436-a7cd1e5bbf61",
    "stepId": "d157cd1a-c81d-53df-bf6b-ecdc38e6298f",
    "glyphInstanceId": "c6075091-af49-4dfe-a2f6-865e76aadd16",
    "position": 0,
    "attempt": 1,
    "inputMaturity": 10,
    "outputMaturity": 20,
    "inputArtifacts": [
      "26c2c152-c9ed-4361-8337-a1fbab1512ac"
    ],
    "outputArtifacts": [
      "0cf55593-5da5-43a1-91b5-cb7452617941"
    ],
    "transformation": {
      "name": "expand-geometry",
      "version": "1.0"
    },
    "geometry": {
      "kind": "DRAWABLE_GEOMETRY",
      "segments": [
        {
          "x1": 0.0,
          "y1": 0.0,
          "x2": 0.0,
          "y2": 7.0
        },
        {
          "x1": 0.0,
          "y1": 3.5,
          "x2": 3.5,
          "y2": 3.5
        },
        {
          "x1": 3.5,
          "y1": 3.5,
          "x2": 0.0,
          "y2": 0.0
        }
      ],
      "boundingBox": {
        "xMin": 0.0,
        "yMin": 0.0,
        "xMax": 3.5,
        "yMax": 7.0
      },
      "advanceWidth": 0.5,
      "totalLength": 14.0,
      "segmentCount": 3,
      "geometrySha256": "a1b2c3d4e5f6"
    }
  }
}