{"specversion":"1.0","id":"11111111-1111-4111-8111-111111111111","source":"run-orchestrator","type":"rg.glyph-blueprints.v1","subject":"runs/22222222-2222-4222-8222-222222222222","time":"2026-08-05T00:00:00.000Z","datacontenttype":"application/json","correlationid":"22222222-2222-4222-8222-222222222222","data":{"runId":"22222222-2222-4222-8222-222222222222","planId":"33333333-3333-4333-8333-333333333333","stepId":"44444444-4444-4444-8444-444444444444","attempt":1,"inputArtifacts":[],"outputArtifacts":[],"transformation":{"name":"plan-glyphs","version":"1.0.0"},"glyphs":[{"glyphInstanceId":"55555555-5555-4555-8555-555555555555","position":0,"kind":"DRAWABLE","advanceWidth":1.0,"primitives":[{"type":"POLYLINE","points":[{"x":0.1,"y":0.0},{"x":0.1,"y":1.0}]},{"type":"POLYLINE","points":[{"x":0.9,"y":0.0},{"x":0.9,"y":1.0}]},{"type":"POLYLINE","points":[{"x":0.1,"y":0.5},{"x":0.9,"y":0.5}]}]}]}}
